{
  "gamesDir": "games",
  "theme": {
    "title": "gamestr arcade",
    "accent": "#7cf3ff",
    "crt": true
  },
  "attractTimeoutMs": 20000,
  "kiosk": true,
  "controllerRelay": "wss://controller.pallasite.app/",
  "leaderboard": {
    "provider": "gamestr",
    "relays": [
      "wss://main.relay.gamestr.io",
      "wss://relay.trotters.cc",
      "wss://nos.lol",
      "wss://relay.damus.io",
      "wss://relay.nostr.band",
      "wss://relay.primal.net",
      "wss://relay.ditto.pub"
    ],
    "topN": 5
  },
  "donation": {
    "address": "profusemeat89@walletofsatoshi.com",
    "message": "ZAP THE ARCADE - IT KEEPS THE GAMES FREE",
    "minSessionSeconds": 45,
    "showSeconds": 30
  }
}
